uuid,name,title,description,url,category,status,created_at
3f4f9651-44e6-4b4a-a1cc-80a6df308984,tumf-grafana-loki-mcp,tumf/grafana-loki-mcp,Grafana API를 통해 Loki 로그를 쿼리할 수 있는 MCP 서버입니다.,https://github.com/tumf/grafana-loki-mcp,monitoring,active,NOW()
98a75265-e96b-412c-bee3-f332e46a50a8,modelcontextprotocol-server-sentry,@modelcontextprotocol/server-sentry,오류 추적 및 성능 모니터링을 위한 Sentry.io 통합,https://github.com/modelcontextprotocol/servers/tree/main/src/sentry,monitoring,active,NOW()
47c42e3d-686a-484f-bba4-b611244f45c2,MindscapeHQ-server-raygun,@MindscapeHQ/server-raygun,충돌 보고 및 실제 사용자 모니터링을 위한 Raygun API V3 통합,https://github.com/MindscapeHQ/mcp-server-raygun,monitoring,active,NOW()
08766e36-2777-48b9-ab13-af549755447e,metoro-io-metoro-mcp-server,metoro-io/metoro-mcp-server,Metoro로 모니터링되는 쿠버네티스 환경 쿼리 및 상호 작용,https://github.com/metoro-io/metoro-mcp-server,monitoring,active,NOW()
4bff5699-a7be-4f1a-b900-36c9c102a9f3,grafana-mcp-grafana,grafana/mcp-grafana,"Grafana 인스턴스에서 대시보드 검색, 인시던트 조사 및 데이터 소스 쿼리",https://github.com/grafana/mcp-grafana,monitoring,active,NOW()
ce6fc196-2a60-47a9-94f4-652896174a61,pydantic-logfire-mcp,pydantic/logfire-mcp,Logfire를 통해 OpenTelemetry 추적 및 메트릭에 대한 접근 제공,https://github.com/pydantic/logfire-mcp,monitoring,active,NOW()
d1ca9b49-29cd-419e-b299-98518c5be4c0,seekrays-mcp-monitor,seekrays/mcp-monitor,"모델 컨텍스트 프로토콜(MCP)을 통해 시스템 메트릭을 노출하는 시스템 모니터링 도구. 이 도구를 사용하면 LLM이 MCP 호환 인터페이스를 통해 실시간 시스템 정보를 검색할 수 있습니다. (CPU, 메모리, 디스크, 네트워크, 호스트, 프로세스 지원)",https://github.com/seekrays/mcp-monitor,monitoring,active,NOW()
b2e5e44c-3b9e-45a8-8d04-8289c43b9ba7,hyperb1iss-lucidity-mcp,hyperb1iss/lucidity-mcp,복잡성에서 보안 취약점에 이르기까지 10가지 중요한 차원에 걸쳐 지능적이고 프롬프트 기반 분석을 통해 AI 생성 코드 품질 향상,https://github.com/hyperb1iss/lucidity-mcp,monitoring,active,NOW()
